stars,rating,text
1,Negative,This was just plain bad.  It had a really overly thick crust with a thin layer of cheese and sauce.  It tasted like school lunch pizza from high school in the 80's.  The sausage also tasted cheap.  I wouldn't recommend this place.
2,Negative,"* Overpriced, but that is to be expected for their location.
* The water tasted gross. I get that it is tap water.. but everywhere has tap water and it does not taste that way.
* There is only one men's restroom and one women's restroom. That is not enough for the size of this place... especially when the food is overpriced, I do not want to wait for a restroom!
* My husband had the CALABRESE pizza. The toppings were sparse. Their was little sauce on the pizza. The crust was dark and had a burnt taste.
* I had the meatballs. They were bland and you could tell they had huge croutons in them. The sauce they were in was thin and greasy. I tried adding my meatballs and sauce to a slice of my husbands pizza and it still didn't taste good!
* I did not like the green sauce they seemed to put on everything. 
* The Caesar salad was fresh, but $12.
* The service was good.

They definitely get business because of their location, not because of the food! There are so many better places in Las Vegas!"
1,Negative,"I will begin by saying this was my worst dining experience in as long as I can remember. Since I am from NY, I have had pizza experiences galore. However, any human needing to eat needs to avoid this place.
First of all, there was no staff- just one young lady attempting to do about 4 jobs. This place needs proper staffing in a big way. She was the cashier, bartender, waiter, etc. 
We ordered a large pizza with 2 toppings, well done. It arrived, not well done, WITHOUT sauce!!!!!!!!!!. The most tasteless, dryest, horrible pie I ever had!!!!!
Please avoid this place at all costs."
1,Negative,"Oh man ... this is NOT good pizza ... it's CHEAP and they usually have an all you can eat lunch buffet but the 'za is about as good as Little Caesar's Pizza (i.e. ""not so much"")"
2,Negative,"I don't normally write reviews however I just spent $8.00 on a greasy, warm(not hot) piece of pizza and a salad (that went straight to the trash it was so awful). Save your money I would rather have a Little Caesar pizza then eat at Rays again."
2,Negative,Food is good and I dont mine waiting awhile for delivery. But we got the wrong pizza (which it happens) I called and they said the would switch the pizzas out. So delivery man came back and we swaped pizzas. I was reassured that mine was in the delivery car the whole time. I know they gave the pizza I had in my house that I opened to someone else. I lost my trust in them. I know I am a clean person and did not touch the pizza it self. But what if I did something to it? You dont know now days.  Should be once out of the sight of the driver you cant give it to anyone else. Then I cant get their contact page to work on the web sight. Will give them a call tomorrow.
1,Negative,"This place is a mess.  Called on Saturday evening 6:20 PM.  10 minutes on hold, hung up.  Called back and ordered 2 pizzas.  At 8:00 no pizza so a I called back, manager tells me they see that I ordered, but whoever took the order didn't hit the send button.  Uhhh, ok.  Puts me on hold, after 10 minutes I hang up.  I call back, no apology, but took the order again and said they'd rush it out in 25 minutes.  An hour later no pizza, I call back.  They have no record of my order.  Manager doesn't know who I am.  I tell him what happened and that I had talked to the manager, he tells me they have different manager.  He asks if I want to reorder, I can tell that this is actually the manager and he does apologize.  No pizza that night.  I've ordered from this place dozens of times over the years and never had a problem, but something has changed."
2,Negative,"Pizza was ok. Service was not so great. If you like attentive service and good pizza for a good price, don't come here....go to spinattos! I ordered a spinach pie, and could count on one hand how much spinach was in it. Garlic bread had no garlic. Crust is decent but has no taste.  One last thing...dont order the antipasto salad. 16 dollars for a big bowl of nothing. We won't be coming back."
1,Negative,"Ordered a couple pizzas and a bottle of water for delivery from the McKnight Rd Pizza Hut. My husband paid in cash and when he came inside I saw that we didn't get the bottle of water and the pizza didn't have all the ingredients on it that we asked for. When I called to have it fixed, some Pizza Hut operator told me that he couldn't get the McKnight store to pick up the phone and that more often then not they stop answering after 9PM because they don't want any more orders because the store closes at 10PM. That's fine except I wasn't placing a new order I was just trying to get the order that I already paid for! He told me I should try to call back the next day. Seriously? Ridiculous."
1,Negative,"Without bashing the entire franchise, Giordano's is a great pizza stop on the south side of chicago. Growing up 10 minutes away from the original location means you spend a lot of time there. Since moving to arizona less than a year ago, I was excited to see Giordano's had made its way west. After trying their pizza 3 times, it proves me right that any pizza here is incomparable to chicago and it's somewhat embarrassing to the original locations. Nothing tastes the same and it's always a long wait just to be disappointed in the product. Apparently, if I want good pizza i'm going to have to go back home for that."
1,Negative,"They messed up the first pizza, no cheese on one side  (how that happens is beyond me). So we waited for a replacement which was even worse,  barely any sauce and less cheese than the first one.  They did give us both pizzas for the price of one else, but it should have been free."
1,Negative,"Please beware, this is not Italian food.  I ordered a fish special from the chalk board that claimed to come with spinach risotto.   The fish had a terrible taste and the risotto was uncle bens rice with some spinach tossed in.  I love risotto and it is supposed to be made from short grained arborio rice and should be creamy and served al dente.  This long grained rice was boiled to the point of being overcooked and simply slapped on my $29 plate.  The  more I think about it the angrier I get. 

The Mediterranean pizza was closer to but not as good as pizza pizza rather the an authentic Italian pie.  

This restaurant may draw tourists and unwitting torontonians who don't know better, but I would not go back to an Italian restaurant that doesn't know what risotto is."
2,Negative,"Certainly cannot agree with the 4+5 star reviews ot this place, since it may be the most expensive pizza restaurant in Las Vegas. We ordered the Gotham Pizza, which is ""supposed"" to include pepperone, sausage & salami, but there was ZERO salami, & only a smattering of sausage. Perhaps a dozen circles of pepperoni. Lots of cheese if that pleases you? For $28 I think customers should expect something ""better"". Onions? Peppers? Olives? Mushrooms?  However, anything above the minimal serving of meat, would push the price well above $30, since each ingredient adds another $2. For those who want to spend $30-40++ on a 16"" pizza, I wish them well. For us -- we go to Wolfgang Puck's in the Crystal Shopping Mall attached to ARIA, & get a better pizza for 1/2 the price."
2,Negative,"I'll give a rating of OK.  I have been there twice.  The first time I didn't like it at all.  The pizza was too burnt.  All their pizza ends up a little burnt, but this one was overly burnt.  The wings were also flavorless and terrible.

The second time I went was for someones birthday.  I kind of went kicking and screaming, but this time the pizza was a lot better, but still not as good as you can get a lot of other places, and it's quite expensive compared to other pizza places.  It's not really terrible pizza, but for the big bucks they charge, go somewhere with better pizza.  

So all that being said, would I go there by choice?  No.  Would I be ok going back if I had to, yeah."
1,Negative,"Great food, but had a terrible large group experience. Last year we had our staff Christmas party at Cibo and had such a good experience that we decided to book at Cibo again this year. We had about 35 guests and did the family-style dinner. Wow, were we surprised when we each received HALF the quantity of food compared to last year and each paid fully TWICE the price as last year!! Unbelievable!! Last year we each paid $40 each (includes gratuity, etc.) and this year we each paid OVER $80 EACH. Seriously, Cibo... who do you guys think you are??  Teatro? Ceasars Steackhouse? Ruth's Chris?  You guys serve pizza and fancy pasta... Albeit very good pizza and pasta. So we will definitely NOT be having our staff party there next year. Too bad, because they are a great restaurant with great food and atmosphere. Hopefully they can make some changes."
2,Negative,"Meh. I was so excited to go because the brunch buffet is touted as one of the best in CLT. Not impressed.

Scrambled eggs were dry. Flatbread pizzas were cold. Sausage links were rubbery. Orange juice wasn't freshly-squeezed.

The brewery is spacious and lively and our waitress was great, but the food was truly a disappointment."
1,Negative,"I ordered from this store online and they screwed up my order. I called and spoke to manager Mike and he hung up on me because I wanted a refund instead of a credit. I called back and he admitted he hung up on me and said ""the conversation was over."" He's not management material and what good is a pizza store that can't make an order correctly?"
2,Negative,"Unfortunately, what is otherwise good Pizza is marred by a terrible ordering and customer service experience. This institution frequently quotes 40 minutes for take out pizza and over the course of three visits the food has never been ready at that time. It is clear that they quote an early time for no good reason. I should not have to add a fifteen minute buffer window and risk my pizza being cold."
1,Negative,"Order my pizza online and waited for the updates about delivery which never changed.... then a text came to my phone 19 mins after it was delivered. After getting the pizza a large two topping thin crust it was burnt, tasted stale, and the meat toppings ( which were only on one side as requested) was oily and dry. Needless to say my kids were disappointed and we threw it out.  Not a happy costumer."
1,Negative,Horrible customer service and crazy long wait.. It took 1:45 minutes to get my ordered pizza and wings. I even called back to see if the driver was close and the manager said he'd credit me for the wait.. Soo I called back two days later and the rude staff said we can't just give you free stuff cause your pizza took to long. You are better off going to get a frozen pizza. Don't waste your time or money!
1,Negative,We did the walk up slices.  Way overpriced and pizza tasted like frozen pizza.   They wouldn't give tap water so had to buy bottles.   No seating and wouldn't let us sit down in their patio even though it was not busy at all.   Tourist trap.
1,Negative,"Sent email saying pizza was on its way.  Got pizza 40 minutes later.  It was cold, and not good.  I love pizza hut, but this was disgusting.  The box was gross from where pizza had sit for so long."
1,Negative,"This was the most disappointing restaurant experience I've had in a long time. Though I never ate at the former location in Bethel Park, I wrongly assumed that an established business would have good food and good service. 

The very young hostess seated us right by the door on a day when it was 27 degrees outside. There were at least 10 empty tables where she could have seated us. She just wanted us to sit down so that she could go back to talking to her friend who was sitting at a nearby table. 

There was a man who I gather is the owner seated at the table next to us who heard us talk about how cold it was. He even watched me put my coat on because it was THAT cold. He had a small space heater at his feet and enough meat on his bones so I assume he didn't notice that it was freezing. 

I looked past that because I was so excited that the Pub and Pizza building was finally occupied again. We anxiously waited for our server to come and take our orders. We didn't wait too long. 

The woman was friendly enough but when we asked what they have to drink, she said she didn't know because she doesn't have a list. We asked if they have beer and she said yes then proceeded to list off your standard dive bar drafts and a vanilla 'port.' Um... Porter? 

We ordered our drinks as well as a pizza and some provolone sticks. When the pizza came she put it on a wobbly pizza stand and dropped off the cheese sticks. The pizza stand was so wobbly I thought the pizza may slide off. 

The food didn't look good. The cheese sticks weren't browned. They were sad, skinny sticks that were taken out of the freezer and dropped in the fryer. I've had better cheese sticks in a cafeteria. 

As for the pizza, it was terrible. Soggy and shiny - two things that food should not be. I'm sorry but if you have 'pizza' in your name, you should at least have a decent pie. It's laughable considering all of the good pizza in a 2 mile radius of the joint. 

We finished what we could and wanted to leave but our server disappeared. I went to the bar to ask if we could cash out. The bartender looked at me as if I were an alien. The owner rolled his eyes. He didn't even seem to care that his employees was
weren't taking very good care of his customers. 

Rather than cash me out, the bartender went to find the server. Another 5 minutes went by and she came back to take our card. 

All in all it was a bad experience. By the time we left we felt like the place didn't want customers. It's sad because they are in a good location. They won't last long unless they do huge business selling bud light and karaoke."
2,Negative,"First off- weird configuration with choppy separation of games and dining.  I like Dave & Busters where it's all more incorporated so parents can sit and still be in same room with kids while they play and we can enjoy food and cocktails.  So instead, I followed the kids around, lugging all the winter coats and hats.

After blowing $80 myself and another $100 with friends, we finally went to eat and ordered a bunch of pizzas.  They tasted more like frozen tombstone pizzas but bigger than I though based on yelp reviews.  The problem was service.  Other than taking the initial order and dropping food, we NEVER saw our waitress.  I had to literally walk around the dining room on three occasions flagging down OTHER waitresses for extra plates, drink refills, etc.  the dining area was NOT full.  Each server had maybe a maximum of 3 tables to serve.  

3 hours after being served and then after 20 minutes trying to hunt down our bill, I finally was fed up.  I saw three managers in a corner and approached them and told them what happened and asked for the bill.  Meanwhile, others in my party asked another waitress for my bill, who then found our waitress, who dropped it off.  We sat there, with credit card in the bill sleeve and again, waited and no one came to pick it up.  So I walked the bill and credit card to the manager myself.  The manager (Heather maybe) was on it.  She apologized profusely and said she understaffed the dining room.  I've waitressed before and if a server can't handle 3 tables, they need better servers. Without us asking, the manager comped the ENTIRE meal and gave us free 1 hour play cards.  

While the experience was frustrating- I would go back simply because management responded so well.  I felt bad too, thinking of leaving a tip for the server- not huge but something.  But I saw her talking to the manager and looking at our table and throwing her arms in the air in disgust and then storming off.  That just really turned me off.  She never apologized for any delay.  Not sure if right or not, and might get a lot of flak but I really don't reward bad servers.  We were a table full of hungry people and we sat with empty plates, etc. for. a long time.  That server really missed the opportunity to sell us a salad, some wings and dessert.  But she never checked in on us.

We will return and try the restaurant again simply to support the business and hope they fix their kinks.  And if we get decent service, we will tip appropriately.  But I hope they work this out- it could've been a great locals addition to Town Square."
1,Negative,"The worst pizza I've ever eaten! We were starving and ordered the Viva Las Vegas. I believe the Sopressata was rancid and picked it off. The crust was gooey and nasty. My bf loves meats and ate my pieces. The flavor of the meat permeated the cheese and I only ate some toppings so I had something in my tummy before attending a wine event! We left the event early as my bf started feeling Ill, nauseated by the time we got home and sick all night! I had much less discomfort which was 12 delay in the resulting surprise. 
Worse than Chuck E Cheese!
The cheap beer is the only thing that should be ordered here!"
1,Negative,"the worst i mean the worst customer service. my brother came in here ordered two large pizzas for during their happy hour service, and instead of paying 12.90 for them, he was charged full price $32. i came back with him and we told the cashier we wanted the happy hour price instead of the full price. got the money back, and returned 15 mins later to them having not even started our pizzas! don't catch us back here again."
1,Negative,Very poor customer service. I ordered food at 6:20 pm online my order didn't arrive so I called to see what was going on they said my order was cancelled because of the wrong number. Keep in mind it was placed off my sisters online account. They claimed they called and she said nobody ordered pizza but she's here with me. I said ok fine can I resubmit the order they said sure. 17 mins later I get a knock on the door and there is my pizza. The pizza was cold I told the driver it was ok take the pizza back and I would call and see if they can make my order fresh. I called in and the manager said oh well I can't give u a discount or anything because your number is wrong. That's the least you could have done. Poor customer service at best please do not order from this location!!
1,Negative,"Great place if you want to pay $13 for what tastes and looks like a frozen pizza. Ordered the house salad with lemon vinaigrette which was way too sour and cheesy garlic bread which was decent considering we were starving. Then our pizza came, a simple thin crust pepperoni pizza, which looked and tasted like a frozen pizza. It was served on cardboard... would not recommend and will never be returning."
1,Negative,"I've gone there twice, once when it first opened then again tonight.  Both times extreemly disappointed.   I only went back to give it another shot since I was hopping for my first night going was just an off night.  I was wrong.  The pizza honestly was gross.  It was cold, dough is heavy and flavorless,  sauce was watered down, pepperoni was bad quality and the cheese was actually the only good part.
We unfortunately left half of it and fed it to the birds outside lol.
I wouldn't recommend this place truthfully at all.
Worst part was the owner gave my pizza to another costumer by accident and made me wait another 15 minutes to make and other one."
1,Negative,"Today was an opportunity for Pizza Fire to shine or it would be our last visit. We had free pizza coupons due to lousy service on our last visit. Not much has changed except for the prices and the menu. Coupon stated unlimited toppings. I found out that fresh mozzarella was not a topping?  So I paid the extra $, scratching my head "" if it's not a topping what could it be""? Hey, I was getting a free pizza so $ wasn't a big deal. If you like soggy pizza you would have loved this one. My husband always orders the unlimited or build your own pizza.  Nope, not any more it is off the menu. My husbands pizza was as soggy as mine. Ugh! They were a little more organized than past visits but the pizza needs to improve. Looks like Neapolitan Pizza in the strip mall in front of Costco gets my business with friendly organized staff and a nice crust."
1,Negative,"Ordered this after 12 midnight. Asked for pepperoni with extra sauce and chicken fingers. The order was expected to be delivered in 45 min, it took 15. That was the only positive part of our experience. The fingers were dry and burnt... I mean black on one side, not just overcooked. The pizza is horrible. Barely any toppings, spongy crust. I will never order from them again. Disgusting. Not worth it,"
2,Negative,"Service was good but pizza was awful...dry, scant toppings & it took forever to arrive.  I'm missing Nello's already."
1,Negative,"I forgot why I haven't ordered from here in years. Now I remember after todays carryout.  Watered down marinara.  Dry breadsticks. Undercooked pizza. And messed up order (they forgot one of my toppings - bacon).  See photo.  I didn't call them  to rectify the problem, they'd probably give me the run around for their mistake and having to wait for my correct order, yeah, no, I was too starved to wait.  Papa makes better pizza. Always papa from now on."
2,Negative,"The pretzel app was great, salad good, but the pizza is completely lacking. The sauce is basically tomato paste."
2,Negative,"Note: This review is past due and it was for the time I visited during the month of March. 

Incredibly slow service. There were only two people in the restaurant yet we got our god damn pizza 30 mins later. I was very furious. To top it off, there were only two tables that were occupied and 20 or something vacant ones. Anyways, we ordered the BBQ pizza and once we received it, our first bite into the pizza had BBQ sauce dripping everywhere my plate. That is because they basically downed the whole pizza in BBQ sauce. Me and my friend could not even finish the pizza because it was too drenched with BBQ sauce. However, the pig inside me still gobbled most of it since I do love BBQ pizza.

Seriously, I never want to give a place a one star, because unless they actually treated their customers like trash, that would be the underlying decision to give them a one star. They really need to work on their service because I can only imagine if they were actually busy...if they ever are."
1,Negative,"The pizza wasn't that great at all and neither was the weird garlic bread. 
Wouldn't recommend at all."
2,Negative,"I had a mushroom and cheese pizza delivered.  The mushrooms were cannd, which I actually prefer, and there were lots of them.   The cheese was thick, not too greasy,  and not over seasoned.  The sauce was decent, meaning nothing that stuck out to me as exceptionally bad or good,  but that is where any goodness ends.

I'm from ny and I've only have one pizza in ohio that had a passable crust.   This was not it.

1.  Crust was covered in grease like PH
2.  There was not a lot on the edges of the pizza and what was was crispy or incredibly greasy.
2.  The crust below the pizza was thick and way too greasy.   

Overall a very poor showing.  I will never go back"
2,Negative,"NOT GOOD PIZZA. I can't hate them for making it cheap (that's why I went there), but it's probably the most bland excuse for pizza I've ever had...the first time I've ever been unenthusiastic about finishing leftover pizza.

Service was fine, and it was quick - it's just not very good food. If your only care is filling your stomach on $5, then this place is for you. If you are actually looking for something that tastes good, GO SOMEWHERE ELSE. There are plenty of other pizza joints around that are a million times better."
1,Negative,"I'll start by saying the pizza is really great here and so is the pasta easily four stars. Ive been here a few times, and everyone was helpful. DO NOT GET the girl server with the forehead bangs she ruined our experience. 

TERRIBLE service. Wow. Came in Saturday with a couple of girlfriends, and our server was absolutely terrible. She took forever to bring us our menus, even longer to get our drinks out. It's not like she was even busy she was just screwing around on her phone at the end of the bar. We finally get her to come to the table and she was abrupt and short with us when answering some of the questions we had about the menu. When the food finally did come she practically slammed the plates down. My girlfriend didn't have silverware and again, we had to flag her down for ten mintues so we could enjoy the meal. Didn't get refills once, she didn't come by to ask how everything was. We weren't even half way through the meal when she dropped off the check, we still had a to go order to place and were thinking about dessert. We were long finished before she came back again and was really rude with us when we told her we needed to place two chicken parm dinners to go and she snachtched up the checkbook so fast. Don't know what her problem was. We asked for her superior but she told us he wasn't available, I'll talk to him next time we go in and he'll get an earful."
1,Negative,I have given this place 2 tries and they are just terrible. The sauce here taste funny and the overall pizza was not good. The worst thing about this place is the wait times. The last time I order over the phone app and it said my pizza was ready for pickup at 6:10pm. I got there right on time and watched them hand my order to the person in front of me. They then had to remake my order which made me wait there for 20 minutes.
