stars,rating,text
1,Negative,"Ok, so I've been ordering from this location for months now and each time the delivery service is getting worse. Im at the point that i will not order from then anymore and will not tell anyone of my family or friends to order from them ever after today. I ordered their $25 coupon of 2 large 2 topping pizzas and 20 wings today. I placed this order at 12:35 pm and as told it would take an hour for delivery(which seemed a bit excessive at this time of day. Since it was after lunch rush). So as the hour mark came and then went the order was still not here. At 20 minutes after the hour it was still not here, so I called them to ask where my order was since its now been an hour and 20 minutes. The girl on the phone proceeds to go on to tell me that the order was out for delivery and quickly got off the phone. So again I sat outside waiting and again another 10 minutes went by and no order. I called back again and this time the girl put me on hold to see where the delivery girl was at. She came back on the line and tried to tell me that there was traffic that delayed the driver and that she was less then 5 minutes away. Now that began to irritate me since they are only 3 miles from where I live. There's not that much traffic that would delay a delivery by 30 minutes. The girl just kept saying she was sorry and never offered up any comps of any kind to show any customer appreciation to keep me as a customer. I then asked her what they were going to do to compensate me for not having my food by an hour and a half. She then says oh well I can give you a $10 credit on your account for your next order. I said fine and hung up expecting my order in under 5 minutes as they claimed. Well that was a lie yet again as it took the driver an additional 12 minutes to finally show up. So now its been an hour and 42 minutes; the driver got out and acted like nothing was wrong. She asked ""hi how's your day going?"" I responded with ""it would have been better if my order was here over 40 minutes ago, on time."" She then got very snotty quick and snapped ""well there's only one of me and your total is $30.58."" I said ""well I would like to check to see if my food was still hot before I pay for it."" She pulled out one pizza and handed it to me and I checked it. Granted it wasnt as hot as all my other orders from before but it was warm enough that I went ahead and paid for it. I then handed the driver $40 and she said ""let me get your change."" The change should have been $9.42 she came back and handed me only $9 not even saying sorry I don't have any change, change she just assumed she could keep the 42 cents and hesitated like I was going to give her more for a tip.  Well now I'm seeing red so that's all she got as her tip was the 42 cents she assumed she could just keep and I walked away from her. This whole delivery was the worse experience I have ever had from this place. They acted as though my order didn't matter in any way. They acted like they were irritated with me for being upset for not having my food for over and hour and 40 minutes. It will be awhile before I order from them again if I do decide to."
1,Negative,"I ordered Sophia pizza and I was expecting a delicious food with proper spice. What I ended up eating was testing horrible , super spicy which burned my mouth. I couldn't even have the second slice. The funny thing is we checked the menu to see if there was any indication of the spiciness of the food! No! Nothing . I'm assuming they just dropped the bottle of pepper in the pizza hoping no one will notice."
1,Negative,"Bad service and never enough cheese pizza, this place used to be good but it's gone downhill."
2,Negative,"I've ordered late night delivery for pizza, pasta ans wings as an experiment. Everything sucked. I will never order from them again."
1,Negative,"I ordered there Brooklyn style Philly cheese steak Pizza. I asked for them to put the  garlic crust but I guess the forgot. When I opened up my pizza box I was extremely disappointed  there was little to no meat on the pizza litterly only about two slices had meat on a large pizzs... wtf I did order a philly cheese stake.  Know $23 latter and still dissatisfied.
With so many other pizza options around idk if I will be back."
2,Negative,"If you LOVE Lou Malnatis like I do, you will be very disappointed by this pizza. We ordered a medium cheese deep dish just because this location is close to the house wanted to try it out. The pizza sauce tastes like the sauce out of a jar, super disappointed by this pizza! Wish they changed the sauce then could be a lot better! Won't be coming back, worth the drive to go to Lou's!"
1,Negative,"Just dined here this evening. I have to say this place had hands down the worst service I have ever received. Party of 3 adults, the server suggested we order 3 pizzas and an appetizer. We were not interested in their limited appetizer menu so we decided to skip it and ordered the pizzas. It took 45 minutes to get the food, I know they bake it fresh so I was willing to wait but the pizzas were bland and overpriced. And we had 1 and 3/4 pizza left, her suggestion of 3 pizzas was far too much food. Honestly, I would skip this one."
2,Negative,"We had heard some good things about this place....so we were excited.  However, it's sub-par at best.  Service was slow and rude....a rarity in this part of Wisconsin, and the pizza was edible but I don't understand why people think it's that good.  We won't be back."
2,Negative,"I have been to custom built 3 times now the first time was before my yelp days and I boosted all over facebook about it. I let all my friends and family know how awesome of a place it was as well as how awesome the customer service was. I think things have changed since then. 

Allow me to elaborate, the second time I went to custom built I quickly left the restaurant and choose not to dine there because I was turned off by this one employee today I went back and have found that the employees name is Larry. The time I walked out was because Larry was on the phone in the back and came out front to greet us. When he came out he was holding his cell phone in his hand and asked to wait a second as he finished his call, we didn't see this as a problem so we patiently waited. When Larry returned he had his cell phone in his hand and was hanging it up he placed the phone on a back counter came to the front and asked what type of dough we would like to choose. He quickly grabbed a regular ball of dough and was about to start kneeding it when I stopped him and apologized to him and told him loud and clear that I could not dine at his establishment since I did not see him wash his hands and we walked out. Bummed out by the incident I still did not want to simply stray away because of one employee so I told my wife we would give it some time and try again.

Well we did and we re-tried today. Like I said previously today the same employee that I walked out on was there and he was at the door. I take it that he did not remember the incident as he did not even recognize me. I thought that was great so that I could try and get a new experience and try and forget about the previous incident. I have to say the evening staff that first introduced my wife and I to custom built was exceptional they were up beat and seemed excited to just make a pizza. Today it felt like it was Monday and things were just crawling. If it was not for that one awesome employee that was genuinely happy to be at work I would have walked out once again that employee's name is MOE and the first thing that he did when he saw us and asked us the dough we wanted was go to the sink and wash his hands!! I quickly pointed it out to my wife and said look at that exceptional employee that is washing his hand prior to preparing our food. Moe quickly keeded out the dough and placed it on the order line to get prepared. Excited by a happy employee this made me happy and I quickly remembered the first time I went to custom built. I said to the gentlemen that was preparing my pizza the first time I came here the young man that assisted me suggested to try and get creative instead of having the same mundane pizza. He suggested trying multiple sauces and I remember him saying you can split this pizza into 16th's to try and give us a challenge we love challenges. When I mentioned this to the guy that was helping me today he seemed a little put off by the whole thing and even said I don't know why he would suggest trying so many different things. I ordered the pizza in 3rds so that I could try the different sauces 1 pesto 1 alfredo and 1 spicy. The guy seemed very uncertain on how to spread the sauces in thirds so he just made circles that ended up bleeding into each other in the cooking process. I layered and layered my pizza with topping after topping after topping. I always have fun in that part I feel like I'm a kid again when I get to pick and choose. 

My wife placed he order and I went to pay. When I was paying Larry was at the cash register and I told him that I forgot my belly card but had received the message that all custom built pizzas were 6.95 for the month of April. He said ok and then I showed him my yelp 10% off for checking in for the first time he again shook his head to which I thought was a clear sign for him acknowledging it. I paid the tab and was just handed my change. I thought that was a bit odd so I asked if I could have my receipt. Larry printed a receipt and gave it to me, I say a receipt because I was unsure if it was actually mine I paid with a $100.00 bill and did not nee that on the receipt and I also did not see a discount. I didn't want to be rude and be like YO! WHERE MY DISCOUNT SON!! so I just kept quite and said to myself the food will clearly change my mind and it will be worth every penny.

Well I got my pizza and it was totally not what I expected the sauces had all bleed into each other and I could not tell the difference from what was pesto what was spicy and where the alfredo started and ended. Also today I watched as Larry was at the cash register and then went to make a pizza for a guest with out washing his hands AGAIN!!!! SOME ONE NEEDS TO GO OVER SAFE FOOD HANDLING WITH LARRY BEFORE HE GETS SOMEONE SICK!! 

I don't know if I can try custom built again and I was a fan :(!"
1,Negative,"My last visit

Placed a ""to go"" order 3 small pizzas, 2 with pepperoni and 1 with pepperoni and sausage, all with Asiago flavored crust. I walked in to Hungry Howies to pick up my order and the restaurant was empty.  However, it still took over 5 minutes for an employee to acknowledge I was there and  to get my order. 

The pizza honestly was one of the worst take-out pizzas I have ever had from Hungry Howies and the order wasn't even correct. I wish I would have looked at my order prior to leaving the store.  I called Hungry Howies to let them know that not only was the pizza not very good but my order wasn't correct.  The associate who answered the phone response was ""Sorry bout that, not sure who cooked it.  I guess we can cook another"".  After waiting another 20 minutes to cook another pizza I head back up to Hungry Howies and yes, once again my order wasn't correct (wrong flavor crust). Since I wasn't willing to wait another 20 minutes I took the pizza and headed home.

My previous experiences with Hungry Howies has always been hit or miss. I think I will drive a little further to one of the many other pizza places in my area."
1,Negative,"O STARS an Option? 

Used to come here years ago as a young child, raced all kinds of laps weekly (first opened). Over the years this place has gone down hill! The owner and his son are douchers, cocky, and selfish. They don't care about their employees just their customers that are giving the creedy individuals money on some sort. This place is WAY too over priced for some childish electric carts, buy some (real) gas go-karts.. and take one for a REAL race. The employees are unprofessional, they stand around the counters on their phones, and don't pay attention to the race track for a second set of eyes. 

They don't wear gloves cooking pizzas

You're better off going to FAST LAP or somewhere else with GAS go-karts, and more reasonable prices!"
1,Negative,"As a native Chicagoan I grew up going to Giordano's  as well as the other top Chicago style pizza joints.  I know good Chicago pizza - this is NOT it!  The pizza was undercooked and frankly gross.  My husband, myself and my daughter could not eat it.  We even thew out our leftovers the moment we got home.  They are doing Chicago style pizza a disservice.  The chopped salad was delicious.  The mozzarella triangles were great.  The wait for a table was minimal.  The wait for the pizza was 45 mins as expected.  The restaurant was nice.  The staff was nice.  The high chair was even clean (harder to find then you think).  But if a pizza place can't put out amazing pizza, nothing else matters."
1,Negative,"A couple weeks ago, My friends and I arrived in Phoenix, starving, at about 1am with a 12 hour layover. We shuttled to a motel and discovered our only options were Jack in the Box drive-thru (no car) and Gus's. I'm not going to credit this place with an elaborate review. I didn't know pizza could taste this bad. I mean how do u mess up a pizza. I am not a food critic and I am not picky by any means. My friend could only stomach two slices and he can EAT! The pizza was flavorless, tasted like water just like one other reviewer mentioned and upon swallowing, the cardboard box seemed the more edible of the two. I'm not even kidding. 
I must also mention the price. I know beggars can't be choosers. I don't mind paying out the ear for a edible meal when it's a last resort. 
We paid $50. and change including $5 tip for the ""two gnarly pizzas and disgusting chicken wings special"".   
Included in this price was a credit card fee and an after midnight fee."
2,Negative,"Pizza and food was good but the service was lacking. They don't have the ability to handle large orders the day of.  I don't fault them for having a small kitchen but they should have let me know they couldn't handle two extra large and three large pizzas, wings and a salad. Our order took over two and a half hours to receive and we had to go get it after wanting it delivered."
1,Negative,Last night my family at CiCis  Pizza.  We hadn't eaten in this restaurant for about a year and boy have they changed.  The restaurant is under staffed.  We went up to the counter quite a few times and there were not any pizza's.  It's hard to believe you go to a pizza buffet and NO PIZZA.  We waited 20 minutes for a desert pizza to be made.  There were a few people working really hard but they needed more people.  The floor had old napkin and it took quite a few minutes for the 1 person to take our used plates away.  We will never go back.
2,Negative,"Pizzas are salty. All the time every time. I don't know why 
My kids think it's gonna be better next time. No matter what kinda of pizza it's going to be salty. They also use cheddar cheese on most pizzas.  The salads are good and we have had the Pablo Picasso a couple of times.  The dirty monkey drink I ordered was mostly ice so the next one I ordered I asked if I could have ""light ice"" and when she brought me this the glass was just over half full to ""compensate"" for the ""light ice"".  This was odd in my opinion. The first Dirty Monkey I had was so full of ice that it was all that hit my lip as I drank it."
1,Negative,"Thought I'd give them one more chance, tonight still zero hot and ready pizzas and now the customers are stealing sauces when the cashier leaves the counter, which is more often than she's there."
1,Negative,"Doughy pizza with a bad sauce. 

Plus I ordered mozarella sticks and they did not deliver them, charged me for them, and refused a refund. 

Do not support this business."
2,Negative,"I'm giving them one star because they produce pizza that is among the best in the city and another star because they've proven that Corsa Italia can support a dinning scene that is kicked up a notch.  
The prices are a little high for what they offer and the service could be given some pointers and from what I've seen and read on other sites from past employees, the proprietors and management can use an attitude adjustment.  A server belittled the busboy in front of us once when the busboy brought to me a glass of wine that was only half full.  Another time our white wine was room temperature.  We brought it up with our server who reminded me of Yosemite Sam and wouldn't have looked out of place at a Tea Party rally informed me that white wine is served at a higher temperature than beer.  Yes, thank you tips, now can you please replace my 22 degree wine.  While he did correct the situation in the end, we received the cold shoulder the rest of the evening.  When it came time to paying our bill there was a drink missing from it, we informed him and while we didn't expect him to kiss our feet, didn't receive much more than a, ""uh, ya, thanks."" then printed us a new bill.  
There are many new pizzerias that have opened up with great service and while I appreciate their contribution in terms of atmosphere and food, snooty ""QSA"" isn't what St. Clair West needs."
2,Negative,The pizza is ok nothing to brag about and the service sucks had to go to the counter to get my drinks refilled and they looked at me like I had three heads.
1,Negative,"This place has great pizza but my experience with this location has been awful. They either take over an hour to get you a pizza or they don't deliver it at all. The first time I tried to order a pizza from here they ended up being closed because of a management issue and I never got my pizza (I never got charged) but I also had to wait an hour and a half before realizing it was never coming.

The second time I ordered we had to call about delivery and they had the address written down as Camelflower instead of Camelback. Took about 90 mins. 

The third time I tried to order a pizza it took 90 mins before it was delivered and that was only after I called to check in on it. They gave me a free pizza credited to my account as a result. 

Now, I'm sitting here waiting for yet another pizza that was quoted as being delivered in 45 mins.. It has been 90 minutes, again. We called to check in on the pizza (see a trend?) and they said they only had one driver. Now, I'm wondering if my pizza is going to be cold. 

Bottom line, if you can't figure out how to offer delivery then don't offer it. The food is good but the experience is awful. Stop telling people you deliver if you really don't (I could pull off this kind of delivery service as a one man shop). If you're wondering why Domino's or Pizza Hut has been successful it is because they've mastered the art of pizza delivery. Either figure your system out, or give it up. 

If you're wondering if you should try this place then you should drive to the location and enjoy the food. Don't wait for your pizza to be delivered. You might starve."
1,Negative,"Golly, I would tell people not to go here. I simply ask for four pizzas, two with pepperoni, one with olives, and one with pineapple. They gave me only two pizzas, one with pepperoni and olives, the other with pepperoni and pineapple. I can't eat meat. I was with another person, who didn't mind the other topping on his pepperoni. I went back to let them know they made a mistake. I was charged for two more pizzas one with only olives and one with only pineapple. I saw someone tell the cook, how the pizzas should be made. Once I got my two pizzas, they had pepperoni with olives and pepperoni with pineapples. AGAIN! I was on lunch, there was no point for asking to fix this problem again because I had to go back to work. Brought it up to them, ask them if I could just get my money back since I can't eat the pizzas they made me. I was told I could not get my money back only credit. I don't want credit because that was my lunch money to eat. I was told by the employees,""mistakes happen."" After I ask for my money back. Which I understand mistakes do happen, I work in customers service too. But when I see an employee tell the cook how the pizzas should be made, one with only olives and one with only pineapple, and both pizzas still end up having pepperoni on it. That's not just a mistake. Which I still have the receipt that's says cheese pizzas with olives and pineapple."
1,Negative,"DO NOT EAT HERE!!! i purchased a Groupon deal for family meal: large cheese pizza, 20 wings, 2 L soda. WORST pizza EVER!!we ordered over the phone and picked up the order.it was so greasy, the oil soaked through the box onto my car seat. the flavor is so-so-similar to frozen. the cheese was low quality, the crust was blahh, and the worst part: the sauce was thinly spread.the wings were hard, dry, and tasted like it had been sitting under a heat lamp for hours.the soda was the only thing our family can use. we also ordered manicotti,some Beach title pizza, and garlic knots. manicotti was okay. Beach pizza was same as cheese pizza with only meager toppings thinly spread out. the garlic knots were hard enough to toss like a rock.we had to order from Papa John's.it is so true: if a deal is too good to be true, it usually is.."
2,Negative,"I think I expected more from this place because its supposed to be ""New York"" pizza and the decor of the restaurant is decorated very New York-ish.  But I guess it is New York style, thin crust, sliced pizzas ready in the display window... but as for the taste, yeah not so much.  

The couple times I ordered pizza from there, the crust was semi burned with black burn spots on the crust and on the bottom.  The cannolis were just OK and smaller than others I've had.  

Maybe I'm just comparing it too much to the ""real thing"" and being biased.  Word of advice:  Less than a mile down the road is Rocco's NY Pizza... definitely go there instead!!!"
1,Negative,"No place settings - had to steal from empty table.  Dough wasn't cooked all the way, cold and doughy in spots with hot toppings? Frozen pizza kinda quality. Salads were drenched in dressing to the point of soggy lettuce."
1,Negative,"BAD EXPERIENCED EVERRRR!!! never in my life have complained to any businesses but this Domino's Pizza have the bad service and take forever to have the order ready! took me about  1 hour and 45 minutes (or more) to have my order ready! and gave me attitude!!! what kind of service is thissss????? WOULD never come back here again! ever. 

it deserve 0 star but no choice! anyhowwww, the foods are fine though. if you ever consider ordering pizza from this place. just call in and come pick up in 2 hours! many people were complaining and cancelled orders!!"
1,Negative,"IM USUALLY NOT THIS KIND OF GUY BUT SOMETIMES A BUSINESS DESERVES TO BE PUBLICLY SLAMMED FOR A SOLID PATTERN INCOMPETENCE...There isn't a -4 rating??? So I ordered 5 deep dish pizzas, 2 cheese and 3 pepperoni... pretty simple right? Hard to really screw that up I would think? 
I don't know how hard it is to actually take an order and see it through because I've never worked there but I think it would be easy with computers n stuff, or a pen and paper idk maybe it is a hard job..? 
Anyway I had someone go pick the order up, he didn't know exactly what I ordered but when he came back I ended up with 4 pepperoni pizzas and 1 cheese... 

****This has been FIVE TIMES IN A ROW THEY HAVE COMPLETELY GIVIN ME A DIFFERENT ORDER I HOPE THE WORLD SEES THIS AND AVOIDS THE PLACE, drive down the road a bit further and go to another Ceasars, trust me it's worth the gas****
So that's that, ya lost a customer obviously ya don't care because the last two times I got the wrong order I brought it to their attention but yet you all STILL manage to keep a strong track record of screwing up the most important part, THE ORDER!"
1,Negative,"I just tried to order a pizza for delivery and got a phone call from the general manager saying that they don't deliver to where I live in DeForest.  Except they delivered to my house within the last two weeks!  The manager argued with me saying they never have and told me they don't have record of any orders from my phone number, which I updated when I last ordered online and on their delivery map my address is included.  He basically called me a liar to my face, even though the pizza box from their last delivery to my house is still in the garage waiting to go out with the recycling.  If you changed your coverage area fine, but don't be a jerk to a customer and call them a liar.  I have a medical degree and am not some confused idiot.  Then I got an email saying that my order was being made.  The manager said that they don't deal with online stuff in their store.  Someone needs to get on the same page and be consistent.  WORST CUSTOMER SERVICE I've experienced in years!  I will never order from this franchise nor any other in the area and will be sure to pass along to my friends how they treat customers.  I was so excited to find out they delivered here only to be disappointed.  It's a shame too, because their gluten free pizza was pretty good.  Save yourself the grief and go to Salvatore's Tomato Pie's instead.  Way better pizza and way nicer people!!!"
