stars,rating,text
1,Negative,"I ordered a pizza at 4:49. Got an email that said my pizza would be delivered at 5:18 to5:28. 5:38 still no pizza. Called the store. They said it was out for delivery. I said I knew that it was suppose to be delivered 10 minutes ago. 5:48. Still no pizza. Called the store back. Again, I was told it was out for delivery. 5:48 called the store again. When I was on the phone the pizza came. When it arrived it was COLD."
2,Negative,"The pizza wasn't very warm when it arrived (they didn't use the warming bag at time of delivery) and the order was wrong, but the pizza tasted good."
2,Negative,"Food was great! Loved the pepperoni rolls and the zamboni fries! Service was sub par. They hustled at first; however the server entirely forgot our pizza. When we inquired, she proceeded to blame it on the kitchen. She never apologized, nor did she offer a discount. She coerced us into paying our tab and did not offer to get us any additional food or beverage. Furthermore, she did not pass on to another server that we intended to stay and eat and drink-even though we explicitly stated that. We stayed for 45 minutes waiting to order more food and have our drinks refilled. Our plates were cleared and we were not offered additional food/drink. No one addressed us. L

Overall: good food, bad service."
1,Negative,If I could I could give 0 stars I would. So we show up around 5:30pm on a Monday. Place is pretty empty. Ordered drink which took about 30 mins to get. Ice was already melted in my drink. Ordered apps and meals. We did not get out food until 7:30. We waited a hour and a half for food @ a empty upscale pizza shop. BTW my pizza was cold. And there is some manager guy walking around looking busy but what a joke. Also I ordered a Calzone which was not a Calzone. Crust Chandler Simply Italian is a joke of a place and anyone that waste there money obviously does not care about the food they put in there mouth or any kind of service. What a rip off. Just remember every time someone has a bad experience they tell 10 people. I was with 4 people. That's 50 people in day. I think the major issue is the customer base has no clue what good Italian is. It sad that so many people accept this.
2,Negative,"The pizza was great, but the guys that make it , while we were there they were scratching their heads, taking  their hats off to run fingers through their hair. And one guy that was cutting up something was eating. They need to wash their hands after scratching. Will not be back to this one"
2,Negative,"If Giordano's is looking to compete with Lou Malnati's, they are going to have to improve their dough recipe. The crust tasted like a flaky hard biscuit which is not pleasant on pizza. Lou Malnati's dough has a wonderful yeasty dough flavor while Giordano's doesn't taste like much at all, same as their garlic parmesan french fries. C'mon give us garlic, we can handle it!

To someone who just shoves food in their face and doesn't overly think about it, Giordano's is fine, but if you consider yourself a pizza buff you will probably be let down after the fourth bite. 

Overall Giordano's is not horribly disgusting but it isn't impressive either. They could also stand to hire extra staff to be refilling drinks.
 
If you're looking for a truly spectacular pizza, do yourself a favor and go to Grimaldi's."
1,Negative,"Fix your store, it is so poorly run that I cannot even go there. There are never pizzas ready, they don't answer the phone to make orders, the employees are rude and condescending and the customers are trash!

Our neighborhood is not this gross but if I was from outside the area, I would think it's the slums. Totally unacceptable, get this store fixed immediately. No excuses.

It also has a foul odor to it...the pizza is worth 5 or 6 bucks...nothing special just fix your stupid store and standards"
2,Negative,"Went for the 1st.time to CPK on the advice of a friend, there were 8 in our party. We were seated at a table that was made for 6, kinda cramped for space,we endured because they said the wait for a bigger table would be 20 min. Although there were 2 areas  bigger than where we sat that were empty.  
         Now when your waitress finally shows for drinks (about 5 min) and the first words out of her mouth are.  ""They must think I'm  wonder woman, I already have a table of 7 and a table of 12"". Translated= hey guys, your service is gonna suck but that's not my fault. And it did!!!!
          My wife and I split the pepperoni, sasuage and mushroom pizza, obviously  'shrooms are the cheapest ingredient cause that's about all we could find. Pizza was bland, 'shrooms  overpowering and service sacked. If that's what your looking for in a dining experience, then this is the restaurant and location for you. If not  STAY AWAY!!!!!!!!!!!!!!"
2,Negative,"Horrible customer service. I have gotten food from here a few times expecting to have a better experience from the last, but I was wrong to hope for that. I once called and they answered ""Hold on"" and just put the phone down. After waiting a few minutes they just hung the phone up. I called back again and they answered ""Hold on"" again. I waited for 5 minutes before they took my order. I asked for their specials and the guy on the phone just says ""Well what do you want to know specials on?"" In a kind of sarcastic tone. We've ordered chicken tenders from here many times and were charged for them but received chicken wings instead. This has happened multiple times. When going back they did not even apologize and  they just took the wings back and made us wait for the chicken tenders to be made. Horrible customer service. The food here is WAY OVER PRICED. The pizza is mediocre. They may use ""fresh ingredients"" but really the crust is the best part of the pizza. Maybe I would have thought the food was better if I received better service. 

If you want WAYYYY better NY pizza go to rockos pizza. Way better prices, extremely friendly service, way better EVERYTHING."
1,Negative,"This hot and ready pizza was definitely not the greatest.  The pepperoni is clustered around the center.  The sauce has a spicy kick to it, and neither my children not myself liked it.  The crazy bread is tasty though."
2,Negative,"More like 2.5 stars. I'm giving two so the owners will have more incentive to make the necessary tweaks.

I really wanted to like Strada 241. It's a beautiful space and the service is friendly, but the food was lackluster. We split a salumi plate and each had a pizza (I had the 'nduja). The salumi plate was nice but a little on the small side and lacking in variety, with only three meats. The pizzas looked good but were pretty tasteless - the cheese was bland, the sauce was bland and missing the necessary balance of tanginess and sweetness, and the crust was dried out and lacking flavor (probably a result of the electric oven).

I would come back to try the pastas and also to see if the pizza improves. There's no lack of effort here and the food is honest."
1,Negative,"Used to be a good place. Has gone downhill the last few years. I already know their pizza is not good anymore, it was when they first opened, but I was in the mood for pasta and decided to give them a chance to redeem themselves . 

I ordered to go and when I got their at 8 pm on a Saturday night and there was only one two person table and no other people in the restaurant, I had a feeling something wasn't right. 
Spent $23.17 on two pastas to go. One the was spaghetti with meat sauce, I would compare it to a can of Chef Boyardee. The other was a pesto pasta with chicken, not very good either. 

Threw them both in the trash

After this meal, I also threw my Streets of New York takeout menu in the trash"
1,Negative,One of THE worst pizzas I've ever had. The cooks are really cheap when it comes to cheese (the pizza was almost all tomato sauce) because the cheese was missing. Absolutely no taste. I don't usually bad reviews unless earned and these ppl working here certainly earned a bad review. Maybe the owner is a cheap person and is forcing cooks to be cheap with toppings.
1,Negative,"My review is based on my experience with the management, not the food. The food is just ok, nothing to write home about. Secret pizza at Cosmo is better.

The manager on duty failed to do his duties when I requested him to call security to come assist me when I was being harassed by a drunk belligerent man while in line. I felt unsafe and wanted security to come but the manager NEVER CALLED them. He in fact lied to me saying that they were too busy to assist me. I spoke to security later on that night and they told me they never received a call. 

SHAME ON YOU manager on duty Sunday 1:30AM for lying about calling security."
2,Negative,"Honestly? It tasted weird. I was visiting extended family and we bought two pizzas--1/2 veggie/meat and one cheese. The sauce was too sweet and the veggies were not at all what I expected. Now, Mineo's...better pizza."
1,Negative,"California Pizza Kitchen has always been one of those places that everyone can agree on. The menu is big enough where there is something for everyone and usually everyone walks away happy. Lately though, the quality of the food as gone way down. 

Before I went vegetarian I used to always get the chicken waldorf salad and it was always so good. I love the blue cheese and the candied walnuts. They were addicting. Since I've become vegetarian I settled on the hummus appetizer, grilled vegetable salad, and the wild mushroom pizza. Recently though, they have completed revamped the menu, adding new items, taking old favorites off. For some places, menu changes mean new and exciting food opportunities and makes the visit to that place even better. Not for CPK. 

Recently, since beginning to use yelp, I have wanted to try new places and veer away from old favorites or places that I am used to. However, I tend to have friends and family members who are food-borists... Ya I just invented a new word. A food-borist is someone who never wants to try anything new, and will eat at the same place and order the same exact thing all of the time. My friends are this way. It never fails. Any time one of them has a birthday I get an invitation to eat at CPK and every time I groan. Even before I swore off CPK forever, I was getting extremely tired of it. The second to the last time I went was for my birthday with some friends. I ordered the new roasted vegetable salad and a cup of the vegetarian tortilla soup. I used to love the grilled vegetable salad and was pissed when they replaced it on the menu with roasted vegetable salad. Not good. I struggled through it because my friends paid for my dinner and I didn't want to waste their money. But it was gross, and I vowed never to order it again. The soup was good though. The last time I went was with my sister, husband and niece. This time I ordered the new caramelized peach salad. On the menu, most of the new items sound really good. Its just the execution of them that fails CPK. The peach salad was gross. The peaches were canned and then warmed, and I also saw no caramelization whatsoever. The combination of the peaches with the gorgonzola (my favorite cheese of all time) was so unappetizing. I didn't even get through half of the salad before I said forget it. My husband ordered the garlic cream fettuccine and added sauteed mushrooms and was upset by this as well. The portion size was really small and it was extremely salty. My sister ordered the barbecue cobb salad which was almost entirely jicama. She barely ate half as well because it was just a giant jicama salad! They skimped on all of the other items in the salad and just pretty much covered some jicama in barbecue dressing. 

The pricing at CPK has also become outrageous. It was almost $13 for my salad. For a salad! Does anyone else find that wrong? Considering the ingredients, my salad should have cost $7, tops! Pasta is expensive, pizzas were generally reasonable for awhile but those prices have been raised as well. For such a casual dining place the prices are just exorbitant. The service also sucks. Our waitress probably spent two minutes total the entire meal at our table. No refilled waters, no how is everything. She was just rushing around everyone else's table except ours. 

So we all have made a vow never to return to any CPK. Especially the one in the Chandler Fashion Center. Before I went vegetarian, I got a lovely surprise one morning after eating here and was graced with food poisoning for two days. That was a great experience."
1,Negative,first off i called and the guy barley spoke any english then i had ordered a pizza and had decided to cancel so 2 minutes later i called and canceled but they still charged my credit card so i called and ask for a refund and they pretty much told me too bad so beware of this and i would suggest romas pizza very good and family owned
2,Negative,Second time in and again I wait for a Ready Now plain ole cheese pizza!   I need to learn to go to another store that may be ready to care for customers!
1,Negative,"Ordered delivery for me and the kids. Two hours later, our meal arrived. I called to inquire after about an hour. Was told that the delivery was on the way. Minutes later received a call that it was being fired and would be delivered soon. Do you think it was on the house? Nope. Just got a piece of cheesecake and  20% coupon. Not good enough. 
Now, let's talk food. The meatball ""panini"" was a piece of French bread with a bland/acidic sauce. The meatballs were overcooked and dry. Not a pleasant experience. The pizza sauce was also watery and bland. You'd think that a place called ""Sauce"" would have figured it out by now. Not so."
1,Negative,"If I could give this 0 stars I would.
Delivery took an hour. Pizza arrived cold and not prepared as ordered. Sausage is completely unseasoned pork topping.  Gross is the only word I can think of to describe this pizza. Save your money. You'll get better pizza from the frozen food aisle at Giant Eagle."
2,Negative,"My order got here earlier than expected but the toppings, cheese and sauce is all over the box. Now the crust is soggy. I hate being that person but now I have to call for a new pizza."
1,Negative,"The service is slow and not very friendly and the pizza tastes store bought. I've tried to eat here several times with friends. 
But it just doesn't seem to do anything for me. 
There's a Jack in the Box across the parking lot with hot food and friendly service."
1,Negative,"This place SUCKS! The guy was very nice on the phone taking my order, but then 30 MIN later, I receive some call from Gary saying that they do not deliver to me. Thanks for letting me know when I placed my order and gave you my cc# already!!
I don't know how the pizza is yet, from other location, because it has yet to arrive. 
Waste of time"
1,Negative,"Horrible Food don't waste your money

This is the worse cardboard covered cheese & sauce so called pizza I've ever had, I haven't had this garbage since grade school cafeteria food, Most of the reviews on here rant about what a great place this is how much fun you'll have there. IDK where that place is cuz the one I wan in today in East Liberty by the Home Depot was getto beyond belief the food is bad & the people aren't nice & friendly.

Loudness is an issue there when the lottery area has a sign saying because of back round noise your number may be wrong. Not one person there had decent customer service skills I had to ask the girl 3 times to speak up and I have excellent hearing. I ordered a small pizza I got a medium that was greasy on top but the crust was stale. 

I looked forward to getting some great pizza man this place really disappointed me today."
2,Negative,"Ok for $5 - 6  but not good pizza, no  flavor,  good for young children or anyone else who likes bland pizza!  If they want to charge extra for thin crust they should put it in writing! I would rather give my $5.00 to Little Cesar's!"
2,Negative,"I used to like the pizza from here. Last time I ordered it was still doughy and I had to cook longer. Today it was ice cold. Not even lukewarm. My kid was screaming for pizza so I didn't send it back. But, I won't ever order from here again. $31 plus tip for a cold pizza and cold soup. There was a piece of ""garlic bred"". It was half a sub roll uncooked with some garlic butter on it. Yum. Should have had a can of Progresso and a frozen pizza and saved $25. Wait, I could have saved $35. I tipped $10. I figure a poor kid driving his own car deserves a decent tip. I called to let them know and she said sorry we can replace the pizza. My kid ate the cold thing anyway. And who wants to wait another hour for the replacement? Blah. Next time I'll drive my lazy self over to Bonnanos and pick up a pizza myself."
2,Negative,"I really enjoy the food, can't say the same about their service. I waited an hour and 20 minutes for two pizzas and when they finally arrived they were incredibly cold! Not a happy customer."
1,Negative,Absolutely avoid this place it's a last resort for me and even then I regret it. Undercooked pizza sparse toppings and the rudest employee ever. They need to just shut this place down I've given them so many second chances and will never do it again. When you complain to corporate they send a free pizza for the same location -- how dumb!!! I hope they shut down and something decent fills this prime spot.
2,Negative,"Waiter was over the top cheesy.  Talked too much.  A bit obnoxious.
No gluten-free options for pizza or pasta (Ferro's on St. Clair offers gluten-free options that are amazing - go there instead if you eat gluten-free).
One of the specials had risotto as a side so I asked if I could just have a small bowl of the risotto as my main and the waiter said no - didn't even go check with the kitchen - flat out no.  Treated me like I was asking them to make risotto from scratch.
So I ordered a steak instead which was good but if I wanted steak would have gone to the keg in the first place.
Marcello's is clearly stuck in the past....no variety for those with dietary restrictions."
1,Negative,"My wife and I visited East West Pizza because we purchased a restaurant.com gift certificate for $2 and we've been questing to find decent pizza in the area.

Our meal here was mediocre. We were pleased by the option to have the crust well done (my wife had hers done this way, while I stuck with the regular crust), but the taste was just bland and uninteresting -- totally lacking in the sort of flavour punch that makes a really good pizza.

I wasn't going to bother writing a review of the place as pizza is a pretty subjective area, however several months ago I received a spam email from East West -- I must have filled out some comment card or something so, I emailed them and asked them nicely to remove me from their list. They replied, very apologetic, and promised to do so. 

For the next several months, despite this guarantee, I continued to receive spam in my email from East West. I emailed them again, this time asking more forcefully to be removed from their list and received no reply - just more spam over the next month or two. Tonight I emailed centurylink, their email host, and reported them for spamming.

East West Pizza - two stars for mediocre pizza that I never feel the need to taste again, minus one star for being spammers."
1,Negative,"My fiance ordered from here recently. After waiting almost 2 hours for our pizza to arrive, we called and asked what was going on, they said it would be there soon. Ten to fifteen minutes later it shows up and the driver informed us that they forgot to make the pizza. Any to top it all off we received some cardboard with a thousand dried up pepperoni slices on it. Wouldn't recommend"
2,Negative,"I'm just in the area for the day... Showing some houses to some buyer clients and needed a place to stop for lunch between appointments. I ate too much. This Brother's is not as good as a similar place on Peoria... But it was decent. I would eat here again if driving by and in the mood for pizza. My Pepsi tasted fine. The girl who took my order was happy & pleasant. I got my soda topped off before I left and I got two sides of ranch at no charge... The only thing I was out off by was that I'm glad I didn't have to pay for the ranch because they were both half full which is why I needed two. If I had paid for them, I would have said something. I'm full, happy and ready for a nap... Oh! Need to show houses... 

I ordered the two slices of cheese and a Pepsi and my total was $4.38

Um I went to the bathroom before leaving,.. The door didn't lock and toilet sprayed water (yes toilet water) at me and did not flush properly... Hopefully they get that fixed!"
2,Negative,"2 stars

The pizza is ridiculously overpriced, $17 for an 11-inch pizza?

Our server was a little aggressive, he even complained about his other customers to us.  Who knew what he was saying about us?   He also must have thought we were stupid because he kept explaining the difference between sausage  and pepperoni?  REALLY?

The server really ruined this meal for us, he even tried some adult humor with the serving of the beer.  I'll leave it at that.  So the food never had a chance, we just wanted to leave.

If you eat here...take your time, the pizza comes out real fast.

Being from New Jersey, we know and appreciate good pizza...this was mediocre at best.

We won't be returning."
1,Negative,I called in for delivery and waited an hour for them to deliver my pizza which yes they might have been busy I understand but when they drop it off I didn't take a look at the pizza because I was working and put it in the back in the break room as soon as I went to go get a slice the entire pizza was burned and it looked old. I waited an hour at least you guys should have made sure my pizza was not burn and at least somewhat fresh. It's so mess up. They wouldn't even give my money back.
1,Negative,I do not recommend going to this location what so ever. Please drive a little out of your way and avoid this location. Absolutely nothing hot n ready. While waiting 20 minutes for two pizzas one pep bestest the other a cheese bestest one would think the pizzas would be hot but they were room temp with no pizza sauce and hardly any cheese. Please do not waste your money and time here. I grew up with little Caesars and have been to many in different states over the past 15 years and I have never had such a bad experience food wise I have never left a little Caesars Pizza and thought I was ripped off but this location had me felling like I was ripped off which I was and you will be too. Please go to any other location do not waste your time or money at this location.
2,Negative,"This place is hit or miss depending on who's working, and tonight was a miss.  Pizza Nova is by far the best chain pizza store, and they're usually pretty consistent, but this place is the worst one I've ever frequented.  The pizza tonight tasted almost like nothing.  Not sure why the couple who own the place refuse to put more than an ounce of sauce on the pizza, but that's what you basically get from them.  You dont even taste the sauce, that's how little they put.  The lack of sauce throws off the whole balance of what a pizza is, so all you taste is dough, cheese, and toppings.  It's more like a sandwich with no condiments than a pizza.  We didn't even bother finishing the whole thing, which is unheard of in our household, that's how bland it was.  If there was a better option in the area I wouldn't bother with this place, sadly there isn't."
1,Negative,Really bad experience here. Went in at 6pm for a drink and asked about dueling pianos. They start @ 8pm. Ok. We had two drinks and were hungry. Asked if we could get pizza from across the way and bring in. Yes that was fine. Get your hand stamped so u can come back in. We got pizza (worst ever) and were then told we could not bring it in. Had to sit outside and they were closing the bar for half an hour while they set up. Ate and then got in line to go back in. No charge since we had our hand stamped. Tried to fit at a table and were told NO we had to stand. The tables were reserved!  Nowhere did it state that we needed a reservation nor did the bartender tell us that. Total bullshit way to treat customers who spent $50 on two drinks each!  EXTREMELY disappointed. Sucks
1,Negative,"Ordered from Caliente on a weeknight, and it took an hour and a half to get the pizza.  When we finally got the pizza it was cold.  I was hopeful that after waiting so long the pizza would be worth the wait but was left disappointed.  The toppings were decent but the dough tasted just like the big chains.  

Bottom line - if you want a passable pizza delivered ice cold in two hours this is your place, otherwise you are better off going somewhere else."
1,Negative,"This is one of the worst experiences I've had at a restaurants. We ordered pizza , salad and a sandwich. After over 45 minutes of patiently waiting and no comment from server in what the delay was, we asked the manger about our food. He said he was too busy to help us. He said he would be with us in 10-15 minutes. If we didn't want to wait, we were more than welcome to leave. Who treats customers like that? I told the server we were leaving and left cash for the drinks. She just shrugged her shoulders and said ""do what you have to"". I don't think I gave been treated so poorly as a paying customer in my life. The management is an embarrassment and service, all around was horrendous. What a disappointment."
